{
  "schema_version": "authoring-v1",
  "record_kind": "authoring",
  "run_id": "20260916-integrity-tests",
  "project_root": "C:\\Projects\\DevForgeAI",
  "target_root": "C:\\Projects\\DevForgeAI\\src\\agents\\skills\\advisor",
  "target_name": "advisor",
  "operation": "edit",
  "authorization": "User requested tamper guard tests, ResourceWarning repair and entry-point coverage reporting. Development-only scope retained.",
  "contract": {
    "path": "C:\\Projects\\DevForgeAI\\docs\\plan\\skill-authorings\\advisor\\20260916-integrity-tests\\contract.json",
    "sha256": "e29b7e8c300a56aa38651e3338aab54d9b285186cfb2631a813d918d51943236"
  },
  "inputs": [
    {
      "path": "C:\\Projects\\DevForgeAI\\docs\\plan\\skill-authorings\\advisor\\20260916-integrity-tests-intake\\task-capture.md",
      "sha256": "698124873fcd02a4d662226c3951efb1a459ca3c39b4e4ac2dbd3703de12a161"
    },
    {
      "path": "C:\\Projects\\DevForgeAI\\docs\\plan\\skill-authorings\\advisor\\20260916-integrity-tests-intake\\workflow-design.json",
      "sha256": "dcf2a28cbf99d023f69a96e8eabcb60deee31968cbdbe45d6e08afa492b97c44"
    }
  ],
  "prior_origin": {
    "kind": "authored",
    "reference": {
      "path": "C:\\Projects\\DevForgeAI\\docs\\plan\\skill-authorings\\advisor\\20260916-cleanup-tests\\authoring-baseline.json",
      "sha256": "1eef80b8687b51002d4ebabceb2080ec4dc5c7da8692d5ad193bb33db35f7881"
    }
  },
  "managed_paths": [
    "SKILL.md",
    "artifact-manifest.json",
    "evals/case.schema.json",
    "evals/cases.jsonl",
    "evals/coverage-entrypoints.ini",
    "evals/run_evaluation.py",
    "references/evaluation.md",
    "references/execution.md",
    "scripts/advisor.ps1",
    "scripts/advisor_run.py",
    "scripts/advisor_stream.py",
    "tests/test_cleanup.py",
    "tests/test_integrity.py",
    "tests/test_streaming.py"
  ],
  "retained_user_paths": [
    "agents/openai.yaml",
    "assets/briefing-template.md",
    "assets/request.schema.json",
    "references/briefing-rules.md",
    "references/response-format.md",
    "tests/test_advisor.py",
    "tests/test_auth.py",
    "tests/test_extended.py"
  ],
  "before_manifest": {
    "path": "C:\\Projects\\DevForgeAI\\docs\\plan\\skill-authorings\\advisor\\20260916-integrity-tests\\before-manifest.json",
    "sha256": "33831c9093c5a1a76edce6b2c6731775515813b8e708887f65e734ae7a06398b"
  },
  "candidate_manifest": {
    "path": "C:\\Projects\\DevForgeAI\\docs\\plan\\skill-authorings\\advisor\\20260916-integrity-tests\\candidate-manifest.json",
    "sha256": "7b2ac4db6a232ee815dd9ab1ae7f58c08bb53f6f77e7301298bf8391479f084b"
  },
  "delivered_manifest": {
    "path": "C:\\Projects\\DevForgeAI\\docs\\plan\\skill-authorings\\advisor\\20260916-integrity-tests\\delivered-manifest.json",
    "sha256": "7b2ac4db6a232ee815dd9ab1ae7f58c08bb53f6f77e7301298bf8391479f084b"
  },
  "applied_paths": [
    "artifact-manifest.json",
    "evals/coverage-entrypoints.ini",
    "references/evaluation.md",
    "tests/test_integrity.py",
    "tests/test_streaming.py"
  ],
  "authoring_state": "AUTHORED",
  "validation_status": "NOT_PERFORMED",
  "testing_status": "NOT_PERFORMED",
  "unresolved_issues": [
    "Live Claude qualification and framework acceptance remain unevaluated."
  ],
  "rows": [
    {
      "path": "artifact-manifest.json",
      "b_sha256": "dd317ce71a2a386b205825c83e9b9a7235ae78cc2c5c99cae17dfd5390f589f8",
      "c_sha256": "dd317ce71a2a386b205825c83e9b9a7235ae78cc2c5c99cae17dfd5390f589f8",
      "n_sha256": "246ed473c4554a68537dfa34e57e03ddf6fcafc976adc48dd1667acdf2f37151",
      "action": "USE_NEW"
    },
    {
      "path": "evals/coverage-entrypoints.ini",
      "b_sha256": null,
      "c_sha256": null,
      "n_sha256": "8c89e416aaa4ba21f4dab8ae06a48691c5ca67ab5aa601a6e44644e95026b39c",
      "action": "USE_NEW"
    },
    {
      "path": "references/evaluation.md",
      "b_sha256": "99458bee70a490fd93a94f1d32989b8d5bdf37ed91d5e7d0d075f8800c736158",
      "c_sha256": "99458bee70a490fd93a94f1d32989b8d5bdf37ed91d5e7d0d075f8800c736158",
      "n_sha256": "f1953e240a45d5113e631b53d5cc3761de3973b77f25e4eb1968d3bc8e79bd3c",
      "action": "USE_NEW"
    },
    {
      "path": "tests/test_integrity.py",
      "b_sha256": null,
      "c_sha256": null,
      "n_sha256": "ef9492e0116402bcda084b5f336a5e7780426ae8d5340bb01b1204a89220ac76",
      "action": "USE_NEW"
    },
    {
      "path": "tests/test_streaming.py",
      "b_sha256": "93cd768391a09fbc766c304fe4c0917ef0bff15f7f6e9b56cabb2eaf76550419",
      "c_sha256": "93cd768391a09fbc766c304fe4c0917ef0bff15f7f6e9b56cabb2eaf76550419",
      "n_sha256": "7e89bbae94fec456101a007a060a7d89c6128f469dc6bf78d3f3b2bc23c92db4",
      "action": "USE_NEW"
    }
  ],
  "baseline_manifest": {
    "path": "C:\\Projects\\DevForgeAI\\docs\\plan\\skill-authorings\\advisor\\20260916-integrity-tests\\baseline-manifest.json",
    "sha256": "cb5eb8f5e0c74076a6a7c0bc82bce0b36b6feaac85ae3ce3c95a480645491a3f"
  }
}
